serial number,comment,demojized_comment,cleaned_comment,lemmatized_tokens
1,"ðŸ”¥Professional Certificate Program in Data Engineering  - https://www.simplilearn.com/pgp-data-engineering-certification-training-course?utm_campaign=aReuLtY0YMI&utm_medium=Comments&utm_source=Youtube
ðŸ”¥IITK - Professional Certificate Course in Data Science (India Only) - https://www.simplilearn.com/iitk-professional-certificate-course-data-science?utm_campaign=aReuLtY0YMI&utm_medium=Comments&utm_source=Youtube
ðŸ”¥Caltech Post Graduate Program in Data Science  - https://www.simplilearn.com/post-graduate-program-data-science?utm_campaign=aReuLtY0YMI&utm_medium=Comments&utm_source=Youtube"," fire Professional Certificate Program in Data Engineering  - https://www.simplilearn.com/pgp-data-engineering-certification-training-course?utm_campaign=aReuLtY0YMI&utm_medium=Comments&utm_source=Youtube
 fire IITK - Professional Certificate Course in Data Science (India Only) - https://www.simplilearn.com/iitk-professional-certificate-course-data-science?utm_campaign=aReuLtY0YMI&utm_medium=Comments&utm_source=Youtube
 fire Caltech Post Graduate Program in Data Science  - https://www.simplilearn.com/post-graduate-program-data-science?utm_campaign=aReuLtY0YMI&utm_medium=Comments&utm_source=Youtube",fire professional certificate program in data engineering fire iitk professional certificate course in data science india only fire caltech post graduate program in data science,"['fire', 'professional', 'certificate', 'program', 'datum', 'engineering', 'fire', 'iitk', 'professional', 'certificate', 'course', 'datum', 'science', 'india', 'fire', 'caltech', 'post', 'graduate', 'program', 'datum', 'science']"
2,"100 slides given by my university explained in 6 minutes! Amazing, and thank you so much!","100 slides given by my university explained in 6 minutes! Amazing, and thank you so much!",slides given by my university explained in minutes amazing and thank you so much,"['slide', 'give', 'university', 'explain', 'minute', 'amazing', 'thank', 'much']"
3,"Well, I'm blown away. That was one of the most productive six minutes I spent on YoutTube <3 Thank you!","Well, I'm blown away. That was one of the most productive six minutes I spent on YoutTube <3 Thank you!",well im blown away that was one of the most productive six minutes i spent on youttube thank you,"['well', 'I', 'm', 'blow', 'away', 'one', 'productive', 'six', 'minute', 'spend', 'youttube', 'thank']"
4,Thanks for the explanation understood about Hadoop. Answer is: Ensures fault tolerance. 5:31,Thanks for the explanation understood about Hadoop. Answer is: Ensures fault tolerance. 5:31,thanks for the explanation understood about hadoop answer is: ensures fault tolerance :,"['thank', 'explanation', 'understand', 'hadoop', 'answer', ':', 'ensure', 'fault', 'tolerance', ':']"
5,Wow this is how things should be explained. Simultaneously with strong examples. Thank you for uploading this.,Wow this is how things should be explained. Simultaneously with strong examples. Thank you for uploading this.,wow this is how things should be explained simultaneously with strong examples thank you for uploading this,"['wow', 'thing', 'explain', 'simultaneously', 'strong', 'example', 'thank', 'upload']"
6,"Yay, an explanation that can be understood in plain english with simple examples.
It took my lecturer about 30 minutes to slog through half of this content and it barely made sense to me. This was great.","Yay, an explanation that can be understood in plain english with simple examples.
It took my lecturer about 30 minutes to slog through half of this content and it barely made sense to me. This was great.",yay an explanation that can be understood in plain english with simple examples it took my lecturer about minutes to slog through half of this content and it barely made sense to me this was great,"['yay', 'explanation', 'understand', 'plain', 'english', 'simple', 'example', 'take', 'lecturer', 'minute', 'slog', 'half', 'content', 'barely', 'make', 'sense', 'great']"
7,"thank you for not having ads in the beginning of this video, is all I have to say.","thank you for not having ads in the beginning of this video, is all I have to say.",thank you for not having ads in the beginning of this video is all i have to say,"['thank', 'ad', 'begin', 'video', 'say']"
8,best video I have seen ! The answer to the question : The advantage of the 3x replication in HDFS is mainly that it ensures fault tolerance.,best video I have seen ! The answer to the question : The advantage of the 3x replication in HDFS is mainly that it ensures fault tolerance.,best video i have seen the answer to the question : the advantage of the x replication in hdfs is mainly that it ensures fault tolerance,"['good', 'video', 'see', 'answer', 'question', ':', 'advantage', 'x', 'replication', 'hdfs', 'mainly', 'ensure', 'fault', 'tolerance']"
9,Nice video ! The answer to the question : The advantage of the 3x replication in HDFS is mainly that it ensures fault tolerance.,Nice video ! The answer to the question : The advantage of the 3x replication in HDFS is mainly that it ensures fault tolerance.,nice video the answer to the question : the advantage of the x replication in hdfs is mainly that it ensures fault tolerance,"['nice', 'video', 'answer', 'question', ':', 'advantage', 'x', 'replication', 'hdfs', 'mainly', 'ensure', 'fault', 'tolerance']"
10,"Thank you SimpliLearn, 

1. Straight to the point, 2. Visuals and precise explanation.","Thank you SimpliLearn, 

1. Straight to the point, 2. Visuals and precise explanation.",thank you simplilearn straight to the point visuals and precise explanation,"['thank', 'simplilearn', 'straight', 'point', 'visual', 'precise', 'explanation']"
11,"Amazing
I missed this important lectures in my University
I thought won't able to learn 
But you did so well. Even my professor can't explain this way.
Thank you so much","Amazing
I missed this important lectures in my University
I thought won't able to learn 
But you did so well. Even my professor can't explain this way.
Thank you so much",amazing i missed this important lectures in my university i thought wont able to learn but you did so well even my professor cant explain this way thank you so much,"['amazing', 'miss', 'important', 'lecture', 'university', 'think', 'will', 'not', 'able', 'learn', 'well', 'even', 'professor', 'can', 'not', 'explain', 'way', 'thank', 'much']"
12,Two weeks of study at my university explained in 6 minutes. Thank you.,Two weeks of study at my university explained in 6 minutes. Thank you.,two weeks of study at my university explained in minutes thank you,"['two', 'week', 'study', 'university', 'explain', 'minute', 'thank']"
13,This single 6min video explained more better than large videos & few course,This single 6min video explained more better than large videos & few course,this single min video explained more better than large videos few course,"['single', 'min', 'video', 'explain', 'well', 'large', 'video', 'course']"
14,Amazing how easy and fast you guys could put together all the concepts and information about Hadoop. Congrats !!,Amazing how easy and fast you guys could put together all the concepts and information about Hadoop. Congrats !!,amazing how easy and fast you guys could put together all the concepts and information about hadoop congrats,"['amazing', 'easy', 'fast', 'guy', 'could', 'put', 'together', 'concept', 'information', 'hadoop', 'congrat']"
15,This dude just explained what my teacher explained in 4 hours in 6 mins very nice video !,This dude just explained what my teacher explained in 4 hours in 6 mins very nice video !,this dude just explained what my teacher explained in hours in mins very nice video,"['dude', 'explain', 'teacher', 'explain', 'hour', 'min', 'nice', 'video']"
16,"The answer is C, ensures fault tolerance! I love your videos, really helps me with my Data Science class right now.","The answer is C, ensures fault tolerance! I love your videos, really helps me with my Data Science class right now.",the answer is c ensures fault tolerance i love your videos really helps me with my data science class right now,"['answer', 'c', 'ensure', 'fault', 'tolerance', 'love', 'video', 'really', 'help', 'data', 'science', 'class', 'right']"
17,You describe 2/3 hr of a lecture with in a 5 min. Same like your name SimpleLearn Your Teaching style is superb. Thanks brotherâ¤,You describe 2/3 hr of a lecture with in a 5 min. Same like your name SimpleLearn Your Teaching style is superb. Thanks brother red_heart ,you describe hr of a lecture with in a min same like your name simplelearn your teaching style is superb thanks brother red_heart,"['describe', 'hr', 'lecture', 'min', 'like', 'name', 'simplelearn', 'teaching', 'style', 'superb', 'thanks', 'brother', 'red_heart']"
18,"The advantage of the 3x replication schema in HDFS is Option C: to Ensure fault tolerance.
Your Explanation was Awesome. and i have a question
How we create data product using Hadoop??","The advantage of the 3x replication schema in HDFS is Option C: to Ensure fault tolerance.
Your Explanation was Awesome. and i have a question
How we create data product using Hadoop??",the advantage of the x replication schema in hdfs is option c: to ensure fault tolerance your explanation was awesome and i have a question how we create data product using hadoop,"['advantage', 'x', 'replication', 'schema', 'hdfs', 'option', 'c', ':', 'ensure', 'fault', 'tolerance', 'explanation', 'awesome', 'question', 'create', 'data', 'product', 'use', 'hadoop']"
19,The answer is C. Thanks for best teaching!,The answer is C. Thanks for best teaching!,the answer is c thanks for best teaching,"['answer', 'c', 'thank', 'good', 'teaching']"
20,"5 mins left for my exam, im watching this","5 mins left for my exam, im watching this",mins left for my exam im watching this,"['min', 'leave', 'exam', 'I', 'm', 'watch']"
21,visual explanation was the best part. for a newbie like me I could grasp the concept much faster. The answer to the quiz is fault tolerance. thanks.,visual explanation was the best part. for a newbie like me I could grasp the concept much faster. The answer to the quiz is fault tolerance. thanks.,visual explanation was the best part for a newbie like me i could grasp the concept much faster the answer to the quiz is fault tolerance thanks,"['visual', 'explanation', 'good', 'part', 'newbie', 'like', 'could', 'grasp', 'concept', 'much', 'fast', 'answer', 'quiz', 'fault', 'tolerance', 'thank']"
22,This was amazing.  It's just about the best high level description of HADOOP I've ever seen.,This was amazing.  It's just about the best high level description of HADOOP I've ever seen.,this was amazing its just about the best high level description of hadoop ive ever seen,"['amazing', 'good', 'high', 'level', 'description', 'hadoop', 'I', 've', 'ever', 'see']"
23,all those multiple slides showed in our lectures yet your 6 mins video made me understand and write multiple concepts of hadoop architecture ðŸ™,all those multiple slides showed in our lectures yet your 6 mins video made me understand and write multiple concepts of hadoop architecture  folded_hands ,all those multiple slides showed in our lectures yet your mins video made me understand and write multiple concepts of hadoop architecture folded_hands,"['multiple', 'slide', 'show', 'lecture', 'yet', 'min', 'video', 'make', 'understand', 'write', 'multiple', 'concept', 'hadoop', 'architecture', 'folded_hand']"
24,The answer to the question is : Ensure fault tolerance. Thank you for the video it was very informative,The answer to the question is : Ensure fault tolerance. Thank you for the video it was very informative,the answer to the question is : ensure fault tolerance thank you for the video it was very informative,"['answer', 'question', ':', 'ensure', 'fault', 'tolerance', 'thank', 'video', 'informative']"
25,"Explanation in is very good in less time.i'm also work on hadoop but that kind of knowledge gain today .
Summary:
Hadoop contain 3 measure part:
1) hdfs:hadoop distributed file system
2) MapReduce: basically it is memory management 
3)YARN : it provide management of all kind.

Thank team","Explanation in is very good in less time.i'm also work on hadoop but that kind of knowledge gain today .
Summary:
Hadoop contain 3 measure part:
1) hdfs:hadoop distributed file system
2) MapReduce: basically it is memory management 
3)YARN : it provide management of all kind.

Thank team",explanation in is very good in less timeim also work on hadoop but that kind of knowledge gain today summary: hadoop contain measure part: hdfs:hadoop distributed file system mapreduce: basically it is memory management yarn : it provide management of all kind thank team,"['explanation', 'good', 'less', 'timeim', 'also', 'work', 'hadoop', 'kind', 'knowledge', 'gain', 'today', 'summary', ':', 'hadoop', 'contain', 'measure', 'part', ':', 'hdfs', ':', 'hadoop', 'distribute', 'file', 'system', 'mapreduce', ':', 'basically', 'memory', 'management', 'yarn', ':', 'provide', 'management', 'kind', 'thank', 'team']"
26,"Option C - Ensures Fault Tolerance 


This is very sweet to get the intro of the Hadoop in 5 mints.

Thanks for help.ðŸ‘","Option C - Ensures Fault Tolerance 


This is very sweet to get the intro of the Hadoop in 5 mints.

Thanks for help. thumbs_up ",option c ensures fault tolerance this is very sweet to get the intro of the hadoop in mints thanks for help thumbs_up,"['option', 'c', 'ensure', 'fault', 'tolerance', 'sweet', 'get', 'intro', 'hadoop', 'mint', 'thank', 'help', 'thumbs_up']"
27,The Most Precise and Easy to understand video Ever!!!!!,The Most Precise and Easy to understand video Ever!!!!!,the most precise and easy to understand video ever,"['precise', 'easy', 'understand', 'video', 'ever']"
28,"C) Ensures fault tolerance
Thanks for such information
Appreciable ðŸ‘Œ","C) Ensures fault tolerance
Thanks for such information
Appreciable  OK_hand ",c ensures fault tolerance thanks for such information appreciable ok_hand,"['c', 'ensure', 'fault', 'tolerance', 'thank', 'information', 'appreciable', 'ok_hand']"
29,"Short but very meaningful knowledge video. I am joining a class conducted by organization, before that I was looking for something really meaningful and Lord has brought me here. Thanks","Short but very meaningful knowledge video. I am joining a class conducted by organization, before that I was looking for something really meaningful and Lord has brought me here. Thanks",short but very meaningful knowledge video i am joining a class conducted by organization before that i was looking for something really meaningful and lord has brought me here thanks,"['short', 'meaningful', 'knowledge', 'video', 'join', 'class', 'conduct', 'organization', 'look', 'something', 'really', 'meaningful', 'lord', 'bring', 'thank']"
30,Wow! No body will explain Hadoop so effectively and easily like you. Hats off to you time and effort. Cheers! btw answer would be D: fault tolerance,Wow! No body will explain Hadoop so effectively and easily like you. Hats off to you time and effort. Cheers! btw answer would be D: fault tolerance,wow no body will explain hadoop so effectively and easily like you hats off to you time and effort cheers btw answer would be d: fault tolerance,"['wow', 'body', 'explain', 'hadoop', 'effectively', 'easily', 'like', 'hat', 'time', 'effort', 'cheer', 'btw', 'answer', 'would', ':', 'fault', 'tolerance']"
31,"Seriously, this is a wonderfully summarised version of any Hadoop video.  Well done summary. The answer is C","Seriously, this is a wonderfully summarised version of any Hadoop video.  Well done summary. The answer is C",seriously this is a wonderfully summarised version of any hadoop video well done summary the answer is c,"['seriously', 'wonderfully', 'summarise', 'version', 'hadoop', 'video', 'well', 'do', 'summary', 'answer', 'c']"
32,The advantage of the 3x replication schema in HDFS is Option C: to Ensure fault tolerance.,The advantage of the 3x replication schema in HDFS is Option C: to Ensure fault tolerance.,the advantage of the x replication schema in hdfs is option c: to ensure fault tolerance,"['advantage', 'x', 'replication', 'schema', 'hdfs', 'option', 'c', ':', 'ensure', 'fault', 'tolerance']"
33,"Mind blown explanation, even a kid can understand these concepts by watching this video","Mind blown explanation, even a kid can understand these concepts by watching this video",mind blown explanation even a kid can understand these concepts by watching this video,"['mind', 'blow', 'explanation', 'even', 'kid', 'understand', 'concept', 'watch', 'video']"
34,"Option (C)-Ensures Fault Tolerance.


And really thankss for the full  explanation on HADOOPðŸ‘.This type explanation was what i was looking for from long back..It was very perfect,clear & simpler to understand.ðŸ˜ŠðŸ‘Œ","Option (C)-Ensures Fault Tolerance.


And really thankss for the full  explanation on HADOOP thumbs_up .This type explanation was what i was looking for from long back..It was very perfect,clear & simpler to understand. smiling_face_with_smiling_eyes  OK_hand ",option censures fault tolerance and really thankss for the full explanation on hadoop thumbs_up this type explanation was what i was looking for from long backit was very perfectclear simpler to understand smiling_face_with_smiling_eyes ok_hand,"['option', 'censure', 'fault', 'tolerance', 'really', 'thankss', 'full', 'explanation', 'hadoop', 'thumbs_up', 'type', 'explanation', 'look', 'long', 'backit', 'perfectclear', 'simple', 'understand', 'smiling_face_with_smiling_eyes', 'ok_hand']"
35,Got My All Doubts Cleared. Thanks for uploading the video :),Got My All Doubts Cleared. Thanks for uploading the video :),got my all doubts cleared thanks for uploading the video :,"['get', 'doubt', 'clear', 'thank', 'upload', 'video', ':']"
36,"Answer: C) Ensures fault tolerance
Great explanation!!.","Answer: C) Ensures fault tolerance
Great explanation!!.",answer: c ensures fault tolerance great explanation,"['answer', ':', 'c', 'ensure', 'fault', 'tolerance', 'great', 'explanation']"
37,I have been working on the Mapr environment but I didnâ€™t got clarity on clusters until I watched this video.. Thanks Keep doing the tutorials on this Hadoop!,I have been working on the Mapr environment but I didnâ€™t got clarity on clusters until I watched this video.. Thanks Keep doing the tutorials on this Hadoop!,i have been working on the mapr environment but i didnt got clarity on clusters until i watched this video thanks keep doing the tutorials on this hadoop,"['work', 'mapr', 'environment', 'do', 'not', 'get', 'clarity', 'cluster', 'watch', 'video', 'thank', 'keep', 'tutorial', 'hadoop']"
38,Just saved me a lot of stress going through all the slides from the academy. Amazing! tnxx,Just saved me a lot of stress going through all the slides from the academy. Amazing! tnxx,just saved me a lot of stress going through all the slides from the academy amazing tnxx,"['save', 'lot', 'stress', 'go', 'slide', 'academy', 'amazing', 'tnxx']"
39,"Answer is at least a, b, c and could include d, depending on how you define manage. Yes 3x replication ensures fault tolerance but it also allows parallel execution of jobs to be placed on the same node where a block of data resides. The locality benefit can provide faster data analysis and efficient cluster management depending on the workloads.","Answer is at least a, b, c and could include d, depending on how you define manage. Yes 3x replication ensures fault tolerance but it also allows parallel execution of jobs to be placed on the same node where a block of data resides. The locality benefit can provide faster data analysis and efficient cluster management depending on the workloads.",answer is at least a b c and could include d depending on how you define manage yes x replication ensures fault tolerance but it also allows parallel execution of jobs to be placed on the same node where a block of data resides the locality benefit can provide faster data analysis and efficient cluster management depending on the workloads,"['answer', 'least', 'b', 'c', 'could', 'include', 'depend', 'define', 'manage', 'yes', 'x', 'replication', 'ensure', 'fault', 'tolerance', 'also', 'allow', 'parallel', 'execution', 'job', 'place', 'node', 'block', 'datum', 'reside', 'locality', 'benefit', 'provide', 'fast', 'datum', 'analysis', 'efficient', 'cluster', 'management', 'depend', 'workload']"
40,Thank you so much we want this kind of teachers,Thank you so much we want this kind of teachers,thank you so much we want this kind of teachers,"['thank', 'much', 'want', 'kind', 'teacher']"
41,I believe the answer is C. The 3x replication schema is used to counter when one of the physical storage is in fault/problem. It is act as backup,I believe the answer is C. The 3x replication schema is used to counter when one of the physical storage is in fault/problem. It is act as backup,i believe the answer is c the x replication schema is used to counter when one of the physical storage is in faultproblem it is act as backup,"['believe', 'answer', 'c', 'x', 'replication', 'schema', 'use', 'counter', 'one', 'physical', 'storage', 'faultproblem', 'act', 'backup']"
42,You are a god for beginners. Now I am subscribing your channel,You are a god for beginners. Now I am subscribing your channel,you are a god for beginners now i am subscribing your channel,"['god', 'beginner', 'subscribe', 'channel']"
43,College lecture slides are far >>>>>>> better tahn ur video lecture thanks a lot it helped in my todays exam,College lecture slides are far >>>>>>> better tahn ur video lecture thanks a lot it helped in my todays exam,college lecture slides are far better tahn ur video lecture thanks a lot it helped in my todays exam,"['college', 'lecture', 'slide', 'far', 'well', 'tahn', 'ur', 'video', 'lecture', 'thank', 'lot', 'help', 'today', 'exam']"
44,"Awesome video. It would be great to see the technical example shown in this video.
Btw, the answer is to ensure fault tolerance.","Awesome video. It would be great to see the technical example shown in this video.
Btw, the answer is to ensure fault tolerance.",awesome video it would be great to see the technical example shown in this video btw the answer is to ensure fault tolerance,"['awesome', 'video', 'would', 'great', 'see', 'technical', 'example', 'show', 'video', 'btw', 'answer', 'ensure', 'fault', 'tolerance']"
45,"This is absolute perfection. I recently read a similar book, and it was absolute perfection. ""Mastering AWS: A Software Engineers Guide"" by Nathan Vale","This is absolute perfection. I recently read a similar book, and it was absolute perfection. ""Mastering AWS: A Software Engineers Guide"" by Nathan Vale",this is absolute perfection i recently read a similar book and it was absolute perfection mastering aws: a software engineers guide by nathan vale,"['absolute', 'perfection', 'recently', 'read', 'similar', 'book', 'absolute', 'perfection', 'master', 'aw', ':', 'software', 'engineer', 'guide', 'nathan', 'vale']"
46,c)Ensures fault tolerance.   :-)   Great tutovid !,c)Ensures fault tolerance.   :-)   Great tutovid !,censures fault tolerance : great tutovid,"['censure', 'fault', 'tolerance', ':', 'great', 'tutovid']"
47,WOW!!! thank you sooo muchhhh!!! this was so good and precise. I honestly did not understand anything from uni until I watched this.,WOW!!! thank you sooo muchhhh!!! this was so good and precise. I honestly did not understand anything from uni until I watched this.,wow thank you sooo muchhhh this was so good and precise i honestly did not understand anything from uni until i watched this,"['wow', 'thank', 'sooo', 'muchhhh', 'good', 'precise', 'honestly', 'understand', 'anything', 'uni', 'watch']"
48,"Big Data is not unstructured data as you might have suggested in the beginning. Big Data is around big data sets that are otherwise too large to deal with. Big Data might be generated by a particle accelerator, for example, it will be structured data but will be considered as 'Big Data'. By the way, this term is not commonly used by Data professionals. It's mostly used by managers and marketing people.","Big Data is not unstructured data as you might have suggested in the beginning. Big Data is around big data sets that are otherwise too large to deal with. Big Data might be generated by a particle accelerator, for example, it will be structured data but will be considered as 'Big Data'. By the way, this term is not commonly used by Data professionals. It's mostly used by managers and marketing people.",big data is not unstructured data as you might have suggested in the beginning big data is around big data sets that are otherwise too large to deal with big data might be generated by a particle accelerator for example it will be structured data but will be considered as big data by the way this term is not commonly used by data professionals its mostly used by managers and marketing people,"['big', 'datum', 'unstructured', 'datum', 'might', 'suggest', 'begin', 'big', 'datum', 'around', 'big', 'data', 'set', 'otherwise', 'large', 'deal', 'big', 'datum', 'might', 'generate', 'particle', 'accelerator', 'example', 'structure', 'datum', 'consider', 'big', 'datum', 'way', 'term', 'commonly', 'use', 'data', 'professional', 'mostly', 'use', 'manager', 'market', 'people']"
