serial number,comment,demojized_comment,cleaned_comment,lemmatized_tokens
49,3x replication helps with fault tolerance.. may be 3 years late for a gift voucher..ðŸ˜‡ but wanted a refresher and this video was great on hadoop,3x replication helps with fault tolerance.. may be 3 years late for a gift voucher.. smiling_face_with_halo  but wanted a refresher and this video was great on hadoop,x replication helps with fault tolerance may be years late for a gift voucher smiling_face_with_halo but wanted a refresher and this video was great on hadoop,"['x', 'replication', 'help', 'fault', 'tolerance', 'may', 'year', 'late', 'gift', 'voucher', 'smiling_face_with_halo', 'want', 'refresher', 'video', 'great', 'hadoop']"
50,"All a, b, c and d are right answers","All a, b, c and d are right answers",all a b c and d are right answers,"['b', 'c', 'right', 'answer']"
51,"Best best best ðŸ˜­â¤
Thank you so much for this â¤â¤â¤","Best best best  loudly_crying_face  red_heart 
Thank you so much for this  red_heart  red_heart  red_heart ",best best best loudly_crying_face red_heart thank you so much for this red_heart red_heart red_heart,"['well', 'well', 'good', 'loudly_crying_face', 'red_heart', 'thank', 'much', 'red_heart', 'red_heart', 'red_heart']"
52,C: to Ensure fault tolerance :),C: to Ensure fault tolerance :),c: to ensure fault tolerance :,"['c', ':', 'ensure', 'fault', 'tolerance', ':']"
53,"Thanks for giving lot of information in 6:20 min. Videos, Great job ðŸ’¯","Thanks for giving lot of information in 6:20 min. Videos, Great job  hundred_points ",thanks for giving lot of information in : min videos great job hundred_points,"['thank', 'give', 'lot', 'information', ':', 'min', 'video', 'great', 'job', 'hundred_point']"
54,C:- Ensure fault tolerance,C:- Ensure fault tolerance,c: ensure fault tolerance,"['c', ':', 'ensure', 'fault', 'tolerance']"
55,You deserve a thumbs up.,You deserve a thumbs up.,you deserve a thumbs up,"['deserve', 'thumb']"
56,"Thanks for the explanation! That's what I was looking for! :) Of course, the answer is C - ensure fault tolerance.","Thanks for the explanation! That's what I was looking for! :) Of course, the answer is C - ensure fault tolerance.",thanks for the explanation thats what i was looking for : of course the answer is c ensure fault tolerance,"['thank', 'explanation', 'that', 's', 'look', ':', 'course', 'answer', 'c', 'ensure', 'fault', 'tolerance']"
57,Brilliantly Explained,Brilliantly Explained,brilliantly explained,"['brilliantly', 'explain']"
58,"This is such a useful video, thank you!!","This is such a useful video, thank you!!",this is such a useful video thank you,"['useful', 'video', 'thank']"
59,thumps up is just a small appriciation need  deserve more than that brilliant explanation,thumps up is just a small appriciation need  deserve more than that brilliant explanation,thumps up is just a small appriciation need deserve more than that brilliant explanation,"['thumps', 'small', 'appriciation', 'need', 'deserve', 'brilliant', 'explanation']"
60,Good explanation. Seems like a lot of work to create useless word-frequency maps of nonsense emails though.,Good explanation. Seems like a lot of work to create useless word-frequency maps of nonsense emails though.,good explanation seems like a lot of work to create useless wordfrequency maps of nonsense emails though,"['good', 'explanation', 'seem', 'like', 'lot', 'work', 'create', 'useless', 'wordfrequency', 'map', 'nonsense', 'email', 'though']"
61,Clearest explanation of Hadoop that I have come across.,Clearest explanation of Hadoop that I have come across.,clearest explanation of hadoop that i have come across,"['clear', 'explanation', 'hadoop', 'come', 'across']"
62,How can i like it two times?,How can i like it two times?,how can i like it two times,"['like', 'two', 'time']"
63,"Sir, Thanks a lot for This Amazing Lecture ðŸ™‚","Sir, Thanks a lot for This Amazing Lecture  slightly_smiling_face ",sir thanks a lot for this amazing lecture slightly_smiling_face,"['sir', 'thank', 'lot', 'amazing', 'lecture', 'slightly_smiling_face']"
64,"Yeah ok, so it's RAID but with a different name and a bit more options.","Yeah ok, so it's RAID but with a different name and a bit more options.",yeah ok so its raid but with a different name and a bit more options,"['yeah', 'ok', 'raid', 'different', 'name', 'bit', 'option']"
65,"Good video. Clear and concise.
Answer to quiz - C (Ensures fault tolerance)","Good video. Clear and concise.
Answer to quiz - C (Ensures fault tolerance)",good video clear and concise answer to quiz c ensures fault tolerance,"['good', 'video', 'clear', 'concise', 'answer', 'quiz', 'c', 'ensure', 'fault', 'tolerance']"
66,"c) Ensures Fault Tolerance

Thank you so much for the video - Love it!","c) Ensures Fault Tolerance

Thank you so much for the video - Love it!",c ensures fault tolerance thank you so much for the video love it,"['c', 'ensure', 'fault', 'tolerance', 'thank', 'much', 'video', 'love']"
67,That was the easiest way to learn and understand Hadoop thank you!,That was the easiest way to learn and understand Hadoop thank you!,that was the easiest way to learn and understand hadoop thank you,"['easy', 'way', 'learn', 'understand', 'hadoop', 'thank']"
68,"Ensures fault tolerance.

Great video, thank you so much!","Ensures fault tolerance.

Great video, thank you so much!",ensures fault tolerance great video thank you so much,"['ensure', 'fault', 'tolerance', 'great', 'video', 'thank', 'much']"
69,"Thank you, that's the best explanation I've ever heard.","Thank you, that's the best explanation I've ever heard.",thank you thats the best explanation ive ever heard,"['thank', 'that', 's', 'good', 'explanation', 'I', 've', 'ever', 'hear']"
70,Excellent explanation in 6 mins. Thank you!,Excellent explanation in 6 mins. Thank you!,excellent explanation in mins thank you,"['excellent', 'explanation', 'min', 'thank']"
71,The answer would be (C) Ensures Fault Tolerance! Thanks again. Wonderful presentation,The answer would be (C) Ensures Fault Tolerance! Thanks again. Wonderful presentation,the answer would be c ensures fault tolerance thanks again wonderful presentation,"['answer', 'would', 'c', 'ensure', 'fault', 'tolerance', 'thank', 'wonderful', 'presentation']"
72,hadoop is an amazing way to manage and process big data.,hadoop is an amazing way to manage and process big data.,hadoop is an amazing way to manage and process big data,"['hadoop', 'amazing', 'way', 'manage', 'process', 'big', 'datum']"
73,Best Scientific content creator award goes to simplilearn.,Best Scientific content creator award goes to simplilearn.,best scientific content creator award goes to simplilearn,"['good', 'scientific', 'content', 'creator', 'award', 'go', 'simplilearn']"
74,"thanks for the crystal clear explanation on what hadoop is , coming to the answer of question is c) ensure fault tolerance","thanks for the crystal clear explanation on what hadoop is , coming to the answer of question is c) ensure fault tolerance",thanks for the crystal clear explanation on what hadoop is coming to the answer of question is c ensure fault tolerance,"['thank', 'crystal', 'clear', 'explanation', 'hadoop', 'come', 'answer', 'question', 'c', 'ensure', 'fault', 'tolerance']"
75,This video clarifies the Hadoop concept very well.,This video clarifies the Hadoop concept very well.,this video clarifies the hadoop concept very well,"['video', 'clarifie', 'hadoop', 'concept', 'well']"
76,I never knew Hadoop is a storage unit. Thanking you Genius,I never knew Hadoop is a storage unit. Thanking you Genius,i never knew hadoop is a storage unit thanking you genius,"['never', 'know', 'hadoop', 'storage', 'unit', 'thank', 'genius']"
77,"Great video
Answer is 
Option 3: To ensure faltu tolerant","Great video
Answer is 
Option 3: To ensure faltu tolerant",great video answer is option : to ensure faltu tolerant,"['great', 'video', 'answer', 'option', ':', 'ensure', 'faltu', 'tolerant']"
78,A clear cut video to understand Hadoop components. Thanks a lot.,A clear cut video to understand Hadoop components. Thanks a lot.,a clear cut video to understand hadoop components thanks a lot,"['clear', 'cut', 'video', 'understand', 'hadoop', 'component', 'thank', 'lot']"
79,"wow, this is first time learning about Big Data and how Hadoop works. thank you so much for the explanation. quite excited to give it a try. 
the answer is C: Ensure Fault tolerance. like High Availability in Cloud services terms.","wow, this is first time learning about Big Data and how Hadoop works. thank you so much for the explanation. quite excited to give it a try. 
the answer is C: Ensure Fault tolerance. like High Availability in Cloud services terms.",wow this is first time learning about big data and how hadoop works thank you so much for the explanation quite excited to give it a try the answer is c: ensure fault tolerance like high availability in cloud services terms,"['wow', 'first', 'time', 'learn', 'big', 'datum', 'hadoop', 'work', 'thank', 'much', 'explanation', 'quite', 'excited', 'give', 'try', 'answer', 'c', ':', 'ensure', 'fault', 'tolerance', 'like', 'high', 'availability', 'cloud', 'service', 'term']"
80,"My Answer to Quiz is C. select C because it can split lots of multiple blocks to compute. and they can copy all data from other blocks, so whichever one or more are broken, the data is not lost.","My Answer to Quiz is C. select C because it can split lots of multiple blocks to compute. and they can copy all data from other blocks, so whichever one or more are broken, the data is not lost.",my answer to quiz is c select c because it can split lots of multiple blocks to compute and they can copy all data from other blocks so whichever one or more are broken the data is not lost,"['answer', 'quiz', 'c', 'select', 'c', 'split', 'lot', 'multiple', 'block', 'compute', 'copy', 'datum', 'block', 'whichever', 'one', 'broken', 'datum', 'lose']"
81,Amazing Video!! Really Helpful :D,Amazing Video!! Really Helpful :D,amazing video really helpful :d,"['amazing', 'video', 'really', 'helpful', ':']"
82,"Answer: C! Great quick intro my first time learning, I've kept hearing about Map Reduce and this really made sense!","Answer: C! Great quick intro my first time learning, I've kept hearing about Map Reduce and this really made sense!",answer: c great quick intro my first time learning ive kept hearing about map reduce and this really made sense,"['answer', ':', 'c', 'great', 'quick', 'intro', 'first', 'time', 'learn', 'I', 've', 'keep', 'hear', 'map', 'reduce', 'really', 'make', 'sense']"
83,"Amazing video. Brilliant explanation. The answer is option C , 3x replication ensures fault tolerance","Amazing video. Brilliant explanation. The answer is option C , 3x replication ensures fault tolerance",amazing video brilliant explanation the answer is option c x replication ensures fault tolerance,"['amazing', 'video', 'brilliant', 'explanation', 'answer', 'option', 'c', 'x', 'replication', 'ensure', 'fault', 'tolerance']"
84,This is too amazing. Very helpful. Explained better than anyone. l love it.,This is too amazing. Very helpful. Explained better than anyone. l love it.,this is too amazing very helpful explained better than anyone l love it,"['amazing', 'helpful', 'explain', 'well', 'anyone', 'l', 'love']"
85,This is superb video I really understood the concept of Hadoop I appreciate the effort of simplicity.,This is superb video I really understood the concept of Hadoop I appreciate the effort of simplicity.,this is superb video i really understood the concept of hadoop i appreciate the effort of simplicity,"['superb', 'video', 'really', 'understand', 'concept', 'hadoop', 'appreciate', 'effort', 'simplicity']"
86,"Just WOW!! 
Thank you!","Just WOW!! 
Thank you!",just wow thank you,"['wow', 'thank']"
87,The answer is C. Great video! Thanks!,The answer is C. Great video! Thanks!,the answer is c great video thanks,"['answer', 'c', 'great', 'video', 'thank']"
88,GREAT SUMMARY!!!!! This is the kind of stuff I was looking for!!! +1 sub!,GREAT SUMMARY!!!!! This is the kind of stuff I was looking for!!! +1 sub!,great summary this is the kind of stuff i was looking for sub,"['great', 'summary', 'kind', 'stuff', 'look', 'sub']"
89,You Guys doing a great Job....excellent explanation.....,You Guys doing a great Job....excellent explanation.....,you guys doing a great jobexcellent explanation,"['guy', 'great', 'jobexcellent', 'explanation']"
90,Easy to learn Your teching skills .... Thanks for your Video.,Easy to learn Your teching skills .... Thanks for your Video.,easy to learn your teching skills thanks for your video,"['easy', 'learn', 'teche', 'skill', 'thank', 'video']"
91,"please create more videos, love this!","please create more videos, love this!",please create more videos love this,"['please', 'create', 'video', 'love']"
92,"C)Ensure fault tolerance. 
As replication is used if any of nodes crashes then the data of that node is stored on various other system so no data is lost.","C)Ensure fault tolerance. 
As replication is used if any of nodes crashes then the data of that node is stored on various other system so no data is lost.",censure fault tolerance as replication is used if any of nodes crashes then the data of that node is stored on various other system so no data is lost,"['censure', 'fault', 'tolerance', 'replication', 'use', 'node', 'crash', 'data', 'node', 'store', 'various', 'system', 'datum', 'lose']"
93,Excellent explanation in such a short clip,Excellent explanation in such a short clip,excellent explanation in such a short clip,"['excellent', 'explanation', 'short', 'clip']"
94,"Thanks a lot , u are better than my professor","Thanks a lot , u are better than my professor",thanks a lot u are better than my professor,"['thank', 'lot', 'u', 'well', 'professor']"
95,Excellent introduction!!!,Excellent introduction!!!,excellent introduction,"['excellent', 'introduction']"
96,"10/10, I say this as a person working with a hadoop cluster of more than 200 nodes","10/10, I say this as a person working with a hadoop cluster of more than 200 nodes",i say this as a person working with a hadoop cluster of more than nodes,"['say', 'person', 'work', 'hadoop', 'cluster', 'node']"
97,There was a lot of information in this video and it was very well presented. 3x replication schema ensures fault tolerance,There was a lot of information in this video and it was very well presented. 3x replication schema ensures fault tolerance,there was a lot of information in this video and it was very well presented x replication schema ensures fault tolerance,"['lot', 'information', 'video', 'well', 'present', 'x', 'replication', 'schema', 'ensure', 'fault', 'tolerance']"
98,Nice content in 06 minutes. Well explained. Thank you!!,Nice content in 06 minutes. Well explained. Thank you!!,nice content in minutes well explained thank you,"['nice', 'content', 'minute', 'well', 'explain', 'thank']"
99,It is one of the most valuable explanation. Just Amazing.,It is one of the most valuable explanation. Just Amazing.,it is one of the most valuable explanation just amazing,"['one', 'valuable', 'explanation', 'amazing']"
100,"amazing content, you guys are the best!!!!!","amazing content, you guys are the best!!!!!",amazing content you guys are the best,"['amazing', 'content', 'guy', 'well']"
101,Thank you. Well explained.,Thank you. Well explained.,thank you well explained,"['thank', 'well', 'explain']"
102,Productive 6 Mins ðŸ™Œ,Productive 6 Mins  raising_hands ,productive mins raising_hands,"['productive', 'min', 'raising_hand']"
103,Brilliant work! Thank you.,Brilliant work! Thank you.,brilliant work thank you,"['brilliant', 'work', 'thank']"
104,"Awesome videoooo...! 
Ans: C. Fault tolerance","Awesome videoooo...! 
Ans: C. Fault tolerance",awesome videoooo ans: c fault tolerance,"['awesome', 'videoooo', 'ans', ':', 'c', 'fault', 'tolerance']"
105,Thanks u so much for such a simple and amazing video to understand the concept.ðŸ‘ðŸ‘ðŸ‘ðŸ‘ðŸ‘,Thanks u so much for such a simple and amazing video to understand the concept. clapping_hands  clapping_hands  clapping_hands  clapping_hands  clapping_hands ,thanks u so much for such a simple and amazing video to understand the concept clapping_hands clapping_hands clapping_hands clapping_hands clapping_hands,"['thank', 'u', 'much', 'simple', 'amazing', 'video', 'understand', 'concept', 'clapping_hand', 'clapping_hands', 'clapping_hand', 'clapping_hand', 'clapping_hand']"
106,so easy explained ty guys,so easy explained ty guys,so easy explained ty guys,"['easy', 'explain', 'ty', 'guy']"
107,"Great video, is a good resume of this technology, and the answer is C) Ensure fault tolerance","Great video, is a good resume of this technology, and the answer is C) Ensure fault tolerance",great video is a good resume of this technology and the answer is c ensure fault tolerance,"['great', 'video', 'good', 'resume', 'technology', 'answer', 'c', 'ensure', 'fault', 'tolerance']"
108,Awesome explanation...thank you !!,Awesome explanation...thank you !!,awesome explanationthank you,"['awesome', 'explanationthank']"
109,Thanks For making this amazing and helpful video.!ðŸ™‚,Thanks For making this amazing and helpful video.! slightly_smiling_face ,thanks for making this amazing and helpful video slightly_smiling_face,"['thank', 'make', 'amazing', 'helpful', 'video', 'slightly_smiling_face']"
110,Nice explanation. Thank You,Nice explanation. Thank You,nice explanation thank you,"['nice', 'explanation', 'thank']"
111,"thanks a lot for the explanation, through this video i just understand what the big data is and hadoop is! It's so amazing.","thanks a lot for the explanation, through this video i just understand what the big data is and hadoop is! It's so amazing.",thanks a lot for the explanation through this video i just understand what the big data is and hadoop is its so amazing,"['thank', 'lot', 'explanation', 'video', 'understand', 'big', 'data', 'hadoop', 'amazing']"
112,Excellent! Thank you so much.,Excellent! Thank you so much.,excellent thank you so much,"['excellent', 'thank', 'much']"
113,nice presentation easy to understand,nice presentation easy to understand,nice presentation easy to understand,"['nice', 'presentation', 'easy', 'understand']"
114,amazing explanation of the Hadoop concepts.,amazing explanation of the Hadoop concepts.,amazing explanation of the hadoop concepts,"['amazing', 'explanation', 'hadoop', 'concept']"
115,C:) Fault tolerance is the answer.  Thank you tons for the very awesome and informative video on Hadoop!,C:) Fault tolerance is the answer.  Thank you tons for the very awesome and informative video on Hadoop!,c: fault tolerance is the answer thank you tons for the very awesome and informative video on hadoop,"['c', ':', 'fault', 'tolerance', 'answer', 'thank', 'ton', 'awesome', 'informative', 'video', 'hadoop']"
116,Answer is C! Data is available on other nodes even if other nodes are down or crashed,Answer is C! Data is available on other nodes even if other nodes are down or crashed,answer is c data is available on other nodes even if other nodes are down or crashed,"['answer', 'c', 'datum', 'available', 'node', 'even', 'node', 'crash']"
117,The answer is option C and very good explanation sir thank you,The answer is option C and very good explanation sir thank you,the answer is option c and very good explanation sir thank you,"['answer', 'option', 'c', 'good', 'explanation', 'sir', 'thank']"
118,"Very well explained video ðŸ’¯
Answer of Advantage of 3x replication Schema in HDFS is Option C that is ensure Fault Tolerance.","Very well explained video  hundred_points 
Answer of Advantage of 3x replication Schema in HDFS is Option C that is ensure Fault Tolerance.",very well explained video hundred_points answer of advantage of x replication schema in hdfs is option c that is ensure fault tolerance,"['well', 'explain', 'video', 'hundred_point', 'answer', 'advantage', 'x', 'replication', 'schema', 'hdfs', 'option', 'c', 'ensure', 'fault', 'tolerance']"
119,"thanks for the informative video. in a short video, it explains most of the hadoop components.","thanks for the informative video. in a short video, it explains most of the hadoop components.",thanks for the informative video in a short video it explains most of the hadoop components,"['thank', 'informative', 'video', 'short', 'video', 'explain', 'hadoop', 'component']"
120,Thank you so much ðŸ¥°,Thank you so much  smiling_face_with_hearts ,thank you so much smiling_face_with_hearts,"['thank', 'much', 'smiling_face_with_heart']"
121,"Crisp and short video....upto the pointðŸ”¥
Answer is (C). Ensures fault tolerance","Crisp and short video....upto the point fire 
Answer is (C). Ensures fault tolerance",crisp and short videoupto the point fire answer is c ensures fault tolerance,"['crisp', 'short', 'videoupto', 'point', 'fire', 'answer', 'c', 'ensure', 'fault', 'tolerance']"
122,The advantage of the 3x replication schema in HDFS ---> Option C - Ensure fault tolerance.,The advantage of the 3x replication schema in HDFS ---> Option C - Ensure fault tolerance.,the advantage of the x replication schema in hdfs option c ensure fault tolerance,"['advantage', 'x', 'replication', 'schema', 'hdfs', 'option', 'c', 'ensure', 'fault', 'tolerance']"
123,"THE ANSWER IS C. HDFS IS FAULT-TOLERANCE, IF THE DATANODES CRASHES BECUASE ITS REPLICATICATED IN 3 REPLICATION SCHEMA IN HDFS. No data will be loss, great video.","THE ANSWER IS C. HDFS IS FAULT-TOLERANCE, IF THE DATANODES CRASHES BECUASE ITS REPLICATICATED IN 3 REPLICATION SCHEMA IN HDFS. No data will be loss, great video.",the answer is c hdfs is faulttolerance if the datanodes crashes becuase its replicaticated in replication schema in hdfs no data will be loss great video,"['answer', 'c', 'hdfs', 'faulttolerance', 'datanode', 'crash', 'becuase', 'replicaticate', 'replication', 'schema', 'hdfs', 'datum', 'loss', 'great', 'video']"
124,Totally clear!,Totally clear!,totally clear,"['totally', 'clear']"
125,Thanks for excellent content,Thanks for excellent content,thanks for excellent content,"['thank', 'excellent', 'content']"
126,"Big thank to you.
Amazing video","Big thank to you.
Amazing video",big thank to you amazing video,"['big', 'thank', 'amazing', 'video']"
127,Excellent Videos! Thank you,Excellent Videos! Thank you,excellent videos thank you,"['excellent', 'video', 'thank']"
128,thank you well presented,thank you well presented,thank you well presented,"['thank', 'well', 'present']"
129,c) ensure fault tolerences  thanks for explaination,c) ensure fault tolerences  thanks for explaination,c ensure fault tolerences thanks for explaination,"['c', 'ensure', 'fault', 'tolerence', 'thank', 'explaination']"
130,For last quizI think C is the correct answer. 3X replica is for fault tolerance purpose.,For last quizI think C is the correct answer. 3X replica is for fault tolerance purpose.,for last quizi think c is the correct answer x replica is for fault tolerance purpose,"['last', 'quizi', 'think', 'c', 'correct', 'answer', 'x', 'replica', 'fault', 'tolerance', 'purpose']"
131,Thanks  a lot for this wonderful video...!!!!!,Thanks  a lot for this wonderful video...!!!!!,thanks a lot for this wonderful video,"['thank', 'lot', 'wonderful', 'video']"
132,The best video to explain hadoop in 5 min.,The best video to explain hadoop in 5 min.,the best video to explain hadoop in min,"['good', 'video', 'explain', 'hadoop', 'min']"
133,Amazing video. The advantage of the 3x replication schema in HDFS is fault torance.,Amazing video. The advantage of the 3x replication schema in HDFS is fault torance.,amazing video the advantage of the x replication schema in hdfs is fault torance,"['amazing', 'video', 'advantage', 'x', 'replication', 'schema', 'hdfs', 'fault', 'torance']"
134,great video!! the answer is c. I know the comment is too late but just commenting,great video!! the answer is c. I know the comment is too late but just commenting,great video the answer is c i know the comment is too late but just commenting,"['great', 'video', 'answer', 'c', 'know', 'comment', 'late', 'comment']"
135,"Thanks for making this really easy to understand. Keep making such videos !!!
Answer: (c) Ensures fault tolerance.","Thanks for making this really easy to understand. Keep making such videos !!!
Answer: (c) Ensures fault tolerance.",thanks for making this really easy to understand keep making such videos answer: c ensures fault tolerance,"['thank', 'make', 'really', 'easy', 'understand', 'keep', 'make', 'video', 'answer', ':', 'c', 'ensure', 'fault', 'tolerance']"
136,super explaination ðŸ‘ðŸ‘ðŸŒŸ,super explaination  thumbs_up  thumbs_up  glowing_star ,super explaination thumbs_up thumbs_up glowing_star,"['super', 'explaination', 'thumbs_up', 'thumbs_up', 'glowing_star']"
137,Thank you for this,Thank you for this,thank you for this,['thank']
138,I understand now. Hadoop is bigger than dBase III+. nice and simple video. have a nice day.,I understand now. Hadoop is bigger than dBase III+. nice and simple video. have a nice day.,i understand now hadoop is bigger than dbase iii nice and simple video have a nice day,"['understand', 'hadoop', 'big', 'dbase', 'iii', 'nice', 'simple', 'video', 'nice', 'day']"
139,Great explanation,Great explanation,great explanation,"['great', 'explanation']"
140,"Hi,
Thanks for the video. 
The answer is C","Hi,
Thanks for the video. 
The answer is C",hi thanks for the video the answer is c,"['hi', 'thank', 'video', 'answer', 'c']"
141,This is great. Thank you.,This is great. Thank you.,this is great thank you,"['great', 'thank']"
142,Bhai kya batau kya samjhaya hai. Chummi ekdum <3,Bhai kya batau kya samjhaya hai. Chummi ekdum <3,bhai kya batau kya samjhaya hai chummi ekdum,"['bhai', 'kya', 'batau', 'kya', 'samjhaya', 'hai', 'chummi', 'ekdum']"
