serial number,comment,demojized_comment,cleaned_comment,lemmatized_tokens
143,"The answer is C, which ensures fault tolerance! really help me in my course Advanace Database management Science  topic Big data,hadoop version1 and version 2","The answer is C, which ensures fault tolerance! really help me in my course Advanace Database management Science  topic Big data,hadoop version1 and version 2",the answer is c which ensures fault tolerance really help me in my course advanace database management science topic big datahadoop version and version,"['answer', 'c', 'ensure', 'fault', 'tolerance', 'really', 'help', 'course', 'advanace', 'database', 'management', 'science', 'topic', 'big', 'datahadoop', 'version', 'version']"
144,Very good explanation...,Very good explanation...,very good explanation,"['good', 'explanation']"
145,Thank you so much for this awesome video.,Thank you so much for this awesome video.,thank you so much for this awesome video,"['thank', 'much', 'awesome', 'video']"
146,Loved the content,Loved the content,loved the content,"['love', 'content']"
147,Awesome video. Thanks,Awesome video. Thanks,awesome video thanks,"['awesome', 'video', 'thank']"
148,Great explanation. Thank you.,Great explanation. Thank you.,great explanation thank you,"['great', 'explanation', 'thank']"
149,Congratulations on the video!,Congratulations on the video!,congratulations on the video,"['congratulation', 'video']"
150,GREAT CONTENT,GREAT CONTENT,great content,"['great', 'content']"
151,Thanks for sharing this video.,Thanks for sharing this video.,thanks for sharing this video,"['thank', 'share', 'video']"
152,Awesome explanation,Awesome explanation,awesome explanation,"['awesome', 'explanation']"
153,Nice explanation,Nice explanation,nice explanation,"['nice', 'explanation']"
154,Fantastic video,Fantastic video,fantastic video,"['fantastic', 'video']"
155,"Amazing video ðŸ‘ðŸ» productive 6 min video ,, keep up the good work ðŸ˜Š","Amazing video  clapping_hands_light_skin_tone  productive 6 min video ,, keep up the good work  smiling_face_with_smiling_eyes ",amazing video clapping_hands_light_skin_tone productive min video keep up the good work smiling_face_with_smiling_eyes,"['amazing', 'video', 'clapping_hands_light_skin_tone', 'productive', 'min', 'video', 'keep', 'good', 'work', 'smiling_face_with_smiling_eyes']"
156,Very nice introduction,Very nice introduction,very nice introduction,"['nice', 'introduction']"
157,thank you so much !!,thank you so much !!,thank you so much,"['thank', 'much']"
158,Thank you!,Thank you!,thank you,['thank']
159,amazing video sir,amazing video sir,amazing video sir,"['amazing', 'video', 'sir']"
160,Great. The correct answer is C) Ensures fault tolerance,Great. The correct answer is C) Ensures fault tolerance,great the correct answer is c ensures fault tolerance,"['great', 'correct', 'answer', 'c', 'ensure', 'fault', 'tolerance']"
161,Great! The answer is C.,Great! The answer is C.,great the answer is c,"['great', 'answer', 'c']"
162,very helpful video. thanks.,very helpful video. thanks.,very helpful video thanks,"['helpful', 'video', 'thank']"
163,Cool Explanation,Cool Explanation,cool explanation,"['cool', 'explanation']"
164,The advantage of 3x replication is to ensure fault tolerance in case of node crashing,The advantage of 3x replication is to ensure fault tolerance in case of node crashing,the advantage of x replication is to ensure fault tolerance in case of node crashing,"['advantage', 'x', 'replication', 'ensure', 'fault', 'tolerance', 'case', 'node', 'crash']"
165,Really nice video. The answer is C. Ensures Fault Tolerance.,Really nice video. The answer is C. Ensures Fault Tolerance.,really nice video the answer is c ensures fault tolerance,"['really', 'nice', 'video', 'answer', 'c', 'ensure', 'fault', 'tolerance']"
166,is for Fault Tolerance. tis vid is great.,is for Fault Tolerance. tis vid is great.,is for fault tolerance tis vid is great,"['fault', 'tolerance', 'tis', 'vid', 'great']"
167,Wonderful video..,Wonderful video..,wonderful video,"['wonderful', 'video']"
168,Thanks! Clear,Thanks! Clear,thanks clear,"['thank', 'clear']"
169,Extraordinary!,Extraordinary!,extraordinary,['extraordinary']
170,"Answer: c) fault tolerance 
Great videoðŸ‘ðŸ¿ðŸ‘ðŸ¿ðŸ‘ðŸ¿","Answer: c) fault tolerance 
Great video thumbs_up_dark_skin_tone  thumbs_up_dark_skin_tone  thumbs_up_dark_skin_tone ",answer: c fault tolerance great video thumbs_up_dark_skin_tone thumbs_up_dark_skin_tone thumbs_up_dark_skin_tone,"['answer', ':', 'c', 'fault', 'tolerance', 'great', 'video', 'thumbs_up_dark_skin_tone', 'thumbs_up_dark_skin_tone', 'thumbs_up_dark_skin_tone']"
171,"thanks for the explanation.
the answer to the question is c - ensures fault tolerance","thanks for the explanation.
the answer to the question is c - ensures fault tolerance",thanks for the explanation the answer to the question is c ensures fault tolerance,"['thank', 'explanation', 'answer', 'question', 'c', 'ensure', 'fault', 'tolerance']"
172,Nice presentation.. Thank you..,Nice presentation.. Thank you..,nice presentation thank you,"['nice', 'presentation', 'thank']"
173,Nice explanation.. The answer is C - Ensure fault tollerens,Nice explanation.. The answer is C - Ensure fault tollerens,nice explanation the answer is c ensure fault tollerens,"['nice', 'explanation', 'answer', 'c', 'ensure', 'fault', 'tolleren']"
174,Thanks mate.,Thanks mate.,thanks mate,"['thank', 'mate']"
175,"Storage unit - Distributed System and maintains backup 
Mapreduce - Splits and process the data
YARN - Yet another resources negotiator
- Resource manager, node manager, application master","Storage unit - Distributed System and maintains backup 
Mapreduce - Splits and process the data
YARN - Yet another resources negotiator
- Resource manager, node manager, application master",storage unit distributed system and maintains backup mapreduce splits and process the data yarn yet another resources negotiator resource manager node manager application master,"['storage', 'unit', 'distribute', 'system', 'maintain', 'backup', 'mapreduce', 'split', 'process', 'datum', 'yarn', 'yet', 'another', 'resource', 'negotiator', 'resource', 'manager', 'node', 'manager', 'application', 'master']"
176,All answers is correct.,All answers is correct.,all answers is correct,"['answer', 'correct']"
177,Replications are done to C)  ensure fault tolerance.,Replications are done to C)  ensure fault tolerance.,replications are done to c ensure fault tolerance,"['replication', 'do', 'c', 'ensure', 'fault', 'tolerance']"
178,wonderful video for  beginners like me. Thanks a ton...I think the answer of the question is option c: ensure fault tolerance,wonderful video for  beginners like me. Thanks a ton...I think the answer of the question is option c: ensure fault tolerance,wonderful video for beginners like me thanks a toni think the answer of the question is option c: ensure fault tolerance,"['wonderful', 'video', 'beginner', 'like', 'thank', 'toni', 'think', 'answer', 'question', 'option', 'c', ':', 'ensure', 'fault', 'tolerance']"
179,well explained ...useful,well explained ...useful,well explained useful,"['well', 'explain', 'useful']"
180,best explanation!!! thanks a lot!,best explanation!!! thanks a lot!,best explanation thanks a lot,"['good', 'explanation', 'thank', 'lot']"
181,e) All of the above... but mainly c)ensures fault tolerance.,e) All of the above... but mainly c)ensures fault tolerance.,e all of the above but mainly censures fault tolerance,"['e', 'mainly', 'censure', 'fault', 'tolerance']"
182,Thanks a lot. ðŸŽ‰ðŸŽ‰,Thanks a lot.  party_popper  party_popper ,thanks a lot party_popper party_popper,"['thank', 'lot', 'party_popper', 'party_popper']"
183,"Answer is Option (C)-Ensures Fault Tolerance.
It replicates data on 3 different nodes ,if any node crashes data can be retrieved from another node. I have one question- Since it replicates same data over 3 different nodes ,we required more storage space which comes with additional cost. Is there is any specific method which can be used to reduce this cost  ?","Answer is Option (C)-Ensures Fault Tolerance.
It replicates data on 3 different nodes ,if any node crashes data can be retrieved from another node. I have one question- Since it replicates same data over 3 different nodes ,we required more storage space which comes with additional cost. Is there is any specific method which can be used to reduce this cost  ?",answer is option censures fault tolerance it replicates data on different nodes if any node crashes data can be retrieved from another node i have one question since it replicates same data over different nodes we required more storage space which comes with additional cost is there is any specific method which can be used to reduce this cost,"['answer', 'option', 'censure', 'fault', 'tolerance', 'replicate', 'data', 'different', 'nodes', 'node', 'crash', 'datum', 'retrieve', 'another', 'node', 'one', 'question', 'since', 'replicate', 'data', 'different', 'node', 'require', 'storage', 'space', 'come', 'additional', 'cost', 'specific', 'method', 'use', 'reduce', 'cost']"
184,The answer is C which is to ensure fault tolerance.,The answer is C which is to ensure fault tolerance.,the answer is c which is to ensure fault tolerance,"['answer', 'c', 'ensure', 'fault', 'tolerance']"
185,"The answer is c), just as mentioned earlier in the video.
Also, the video is really helpful and brief, thx!","The answer is c), just as mentioned earlier in the video.
Also, the video is really helpful and brief, thx!",the answer is c just as mentioned earlier in the video also the video is really helpful and brief thx,"['answer', 'c', 'mention', 'early', 'video', 'also', 'video', 'really', 'helpful', 'brief', 'thx']"
186,"Advantage of the 3x replication schema in HDFS is  ""Ensure fault tolerance"".","Advantage of the 3x replication schema in HDFS is  ""Ensure fault tolerance"".",advantage of the x replication schema in hdfs is ensure fault tolerance,"['advantage', 'x', 'replication', 'schema', 'hdfs', 'ensure', 'fault', 'tolerance']"
187,nicely explained and cool diagrams . Thanks,nicely explained and cool diagrams . Thanks,nicely explained and cool diagrams thanks,"['nicely', 'explain', 'cool', 'diagram', 'thank']"
188,"Great Video, the answer to the quiz is C) Ensures fault tolerance.","Great Video, the answer to the quiz is C) Ensures fault tolerance.",great video the answer to the quiz is c ensures fault tolerance,"['great', 'video', 'answer', 'quiz', 'c', 'ensure', 'fault', 'tolerance']"
189,"Answer: C) Ensures fault tolerance
Great and really informative video!!!","Answer: C) Ensures fault tolerance
Great and really informative video!!!",answer: c ensures fault tolerance great and really informative video,"['answer', ':', 'c', 'ensure', 'fault', 'tolerance', 'great', 'really', 'informative', 'video']"
190,"I think I will prefer this kind of animation over the traditional slide show explanation , good work @simplilearn and will be looking forward for these kind of video's","I think I will prefer this kind of animation over the traditional slide show explanation , good work @simplilearn and will be looking forward for these kind of video's",i think i will prefer this kind of animation over the traditional slide show explanation good work simplilearn and will be looking forward for these kind of videos,"['think', 'prefer', 'kind', 'animation', 'traditional', 'slide', 'show', 'explanation', 'good', 'work', 'simplilearn', 'look', 'forward', 'kind', 'video']"
191,u saved me from 100 page ppts before exam,u saved me from 100 page ppts before exam,u saved me from page ppts before exam,"['u', 'save', 'page', 'ppt', 'exam']"
192,advantage of replication scheme in hadoop is that it ensures fault tolerance,advantage of replication scheme in hadoop is that it ensures fault tolerance,advantage of replication scheme in hadoop is that it ensures fault tolerance,"['advantage', 'replication', 'scheme', 'hadoop', 'ensure', 'fault', 'tolerance']"
193,Amazing good job,Amazing good job,amazing good job,"['amazing', 'good', 'job']"
194,awesome video,awesome video,awesome video,"['awesome', 'video']"
195,thanks for shairng,thanks for shairng,thanks for shairng,"['thank', 'shairng']"
196,"it should be option C. Ensures fault tolerance, cause if one goes down other replicas takes place.","it should be option C. Ensures fault tolerance, cause if one goes down other replicas takes place.",it should be option c ensures fault tolerance cause if one goes down other replicas takes place,"['option', 'c', 'ensure', 'fault', 'tolerance', 'cause', 'one', 'go', 'replicas', 'take', 'place']"
197,The advantage of the 3x replication schema in HDFS is Option C: to Ensure fault tolerance.,The advantage of the 3x replication schema in HDFS is Option C: to Ensure fault tolerance.,the advantage of the x replication schema in hdfs is option c: to ensure fault tolerance,"['advantage', 'x', 'replication', 'schema', 'hdfs', 'option', 'c', ':', 'ensure', 'fault', 'tolerance']"
198,The answer to the question is : Ensure fault tolerance. Thank you for the video it was very informative,The answer to the question is : Ensure fault tolerance. Thank you for the video it was very informative,the answer to the question is : ensure fault tolerance thank you for the video it was very informative,"['answer', 'question', ':', 'ensure', 'fault', 'tolerance', 'thank', 'video', 'informative']"
199,Just saved me a lot of stress going through all the slides from the academy. Amazing! tnxx,Just saved me a lot of stress going through all the slides from the academy. Amazing! tnxx,just saved me a lot of stress going through all the slides from the academy amazing tnxx,"['save', 'lot', 'stress', 'go', 'slide', 'academy', 'amazing', 'tnxx']"
200,The advantage of 3x replication is to ensure fault tolerance in case of node crashing,The advantage of 3x replication is to ensure fault tolerance in case of node crashing,the advantage of x replication is to ensure fault tolerance in case of node crashing,"['advantage', 'x', 'replication', 'ensure', 'fault', 'tolerance', 'case', 'node', 'crash']"
201,Option C) Ensures fault tolerance is correct,Option C) Ensures fault tolerance is correct,option c ensures fault tolerance is correct,"['option', 'c', 'ensure', 'fault', 'tolerance', 'correct']"
202,option C is the answer as to save data or replica of the schema which ensure fault tolerance,option C is the answer as to save data or replica of the schema which ensure fault tolerance,option c is the answer as to save data or replica of the schema which ensure fault tolerance,"['option', 'c', 'answer', 'save', 'data', 'replica', 'schema', 'ensure', 'fault', 'tolerance']"
203,very helpful,very helpful,very helpful,['helpful']
204,Thanks for the video!!!! Letter C- ensures fault tolerance...,Thanks for the video!!!! Letter C- ensures fault tolerance...,thanks for the video letter c ensures fault tolerance,"['thank', 'video', 'letter', 'c', 'ensure', 'fault', 'tolerance']"
205,"Awesome explanation.  I loved that , clearly explained all the parts.","Awesome explanation.  I loved that , clearly explained all the parts.",awesome explanation i loved that clearly explained all the parts,"['awesome', 'explanation', 'love', 'clearly', 'explain', 'part']"
206,Amazing video,Amazing video,amazing video,"['amazing', 'video']"
207,"Hi, my answer is ""ensures fault tolerance"". Thank for the clear video, it will be useful for the Azure Data Fundamentals Certification.","Hi, my answer is ""ensures fault tolerance"". Thank for the clear video, it will be useful for the Azure Data Fundamentals Certification.",hi my answer is ensures fault tolerance thank for the clear video it will be useful for the azure data fundamentals certification,"['hi', 'answer', 'ensure', 'fault', 'tolerance', 'thank', 'clear', 'video', 'useful', 'azure', 'datum', 'fundamental', 'certification']"
208,Pretty awesome!!! ..,Pretty awesome!!! ..,pretty awesome,"['pretty', 'awesome']"
209,Good intro video ! Answer is Option C.,Good intro video ! Answer is Option C.,good intro video answer is option c,"['good', 'intro', 'video', 'answer', 'option', 'c']"
210,"thanks ans: A,B,D,... with the possibility of improving C fault capabilities.","thanks ans: A,B,D,... with the possibility of improving C fault capabilities.",thanks ans: abd with the possibility of improving c fault capabilities,"['thank', 'ans', ':', 'abd', 'possibility', 'improve', 'c', 'fault', 'capability']"
211,"most people misinterpret it as a software product, whereas it simply is a framework","most people misinterpret it as a software product, whereas it simply is a framework",most people misinterpret it as a software product whereas it simply is a framework,"['people', 'misinterpret', 'software', 'product', 'whereas', 'simply', 'framework']"
212,"answer is c , it ensures the fault tolerance","answer is c , it ensures the fault tolerance",answer is c it ensures the fault tolerance,"['answer', 'c', 'ensure', 'fault', 'tolerance']"
213,Love it !,Love it !,love it,['love']
214,excellent,excellent,excellent,['excellent']
215,Good knowledge,Good knowledge,good knowledge,"['good', 'knowledge']"
216,very gud ................................,very gud ................................,very gud,['gud']
217,"ensure fault tolerance, thanks for the tutorial","ensure fault tolerance, thanks for the tutorial",ensure fault tolerance thanks for the tutorial,"['ensure', 'fault', 'tolerance', 'thank', 'tutorial']"
218,Replica nodes help in fault tolerance but I think it may also help in load balance as replica nodes which can also take part in search queries which reduce load on one node,Replica nodes help in fault tolerance but I think it may also help in load balance as replica nodes which can also take part in search queries which reduce load on one node,replica nodes help in fault tolerance but i think it may also help in load balance as replica nodes which can also take part in search queries which reduce load on one node,"['replica', 'node', 'help', 'fault', 'tolerance', 'think', 'may', 'also', 'help', 'load', 'balance', 'replica', 'node', 'also', 'take', 'part', 'search', 'query', 'reduce', 'load', 'one', 'node']"
219,thank you,thank you,thank you,['thank']
220,Small Capsule but more informative.  The correct option is C.,Small Capsule but more informative.  The correct option is C.,small capsule but more informative the correct option is c,"['small', 'capsule', 'informative', 'correct', 'option', 'c']"
221,Option C) Ensures fault tolerance,Option C) Ensures fault tolerance,option c ensures fault tolerance,"['option', 'c', 'ensure', 'fault', 'tolerance']"
222,Best one ðŸ˜,Best one  smiling_face_with_heart-eyes ,best one smiling_face_with_hearteyes,"['good', 'one', 'smiling_face_with_hearteye']"
223,Liked - Subscribed - The answer to the quiz is C) Ensures fault tolerance.  =),Liked - Subscribed - The answer to the quiz is C) Ensures fault tolerance.  =),liked subscribed the answer to the quiz is c ensures fault tolerance,"['like', 'subscribe', 'answer', 'quiz', 'c', 'ensure', 'fault', 'tolerance']"
224,"Ensures Fault tolerance, which helps not to lose data if any of the node is down.","Ensures Fault tolerance, which helps not to lose data if any of the node is down.",ensures fault tolerance which helps not to lose data if any of the node is down,"['ensure', 'fault', 'tolerance', 'help', 'lose', 'datum', 'node']"
225,answer: Ensures fault tolerance,answer: Ensures fault tolerance,answer: ensures fault tolerance,"['answer', ':', 'ensure', 'fault', 'tolerance']"
226,"I clicked in this video thinking it would be satire because of the title, still a good video and learned a lot.","I clicked in this video thinking it would be satire because of the title, still a good video and learned a lot.",i clicked in this video thinking it would be satire because of the title still a good video and learned a lot,"['click', 'video', 'thinking', 'would', 'satire', 'title', 'still', 'good', 'video', 'learn', 'lot']"
227,great explanation,great explanation,great explanation,"['great', 'explanation']"
228,"quiz 05:11  My answer is A, B, and C.","quiz 05:11  My answer is A, B, and C.",quiz : my answer is a b and c,"['quiz', ':', 'answer', 'b', 'c']"
229,thanks for the great explanation and answer is C,thanks for the great explanation and answer is C,thanks for the great explanation and answer is c,"['thank', 'great', 'explanation', 'answer', 'c']"
230,the answer is C ie Ensure Fault tolerance.,the answer is C ie Ensure Fault tolerance.,the answer is c ie ensure fault tolerance,"['answer', 'c', 'ie', 'ensure', 'fault', 'tolerance']"
231,Thank you. Easy explaination,Thank you. Easy explaination,thank you easy explaination,"['thank', 'easy', 'explaination']"
232,this video is super useful!!!,this video is super useful!!!,this video is super useful,"['video', 'super', 'useful']"
233,Thank you very much!,Thank you very much!,thank you very much,"['thank', 'much']"
234,This is really helpful.. answer is C,This is really helpful.. answer is C,this is really helpful answer is c,"['really', 'helpful', 'answer', 'c']"
235,"Great Video!! Easy to learn, Ensure Fault tolerant for data block replication in node.","Great Video!! Easy to learn, Ensure Fault tolerant for data block replication in node.",great video easy to learn ensure fault tolerant for data block replication in node,"['great', 'video', 'easy', 'learn', 'ensure', 'fault', 'tolerant', 'data', 'block', 'replication', 'node']"
236,Great explanation..100 times better than our lecturers..thank u,Great explanation..100 times better than our lecturers..thank u,great explanation times better than our lecturersthank u,"['great', 'explanation', 'time', 'well', 'lecturersthank', 'u']"
237,Thank you so much for this simple explanation,Thank you so much for this simple explanation,thank you so much for this simple explanation,"['thank', 'much', 'simple', 'explanation']"
238,The answer is C.(ensures fault tolerance),The answer is C.(ensures fault tolerance),the answer is censures fault tolerance,"['answer', 'censure', 'fault', 'tolerance']"
239,answer is (c) ensures fault tolerance,answer is (c) ensures fault tolerance,answer is c ensures fault tolerance,"['answer', 'c', 'ensure', 'fault', 'tolerance']"
240,all of the above right answer,all of the above right answer,all of the above right answer,"['right', 'answer']"
241,answer is C.Ensures fault tolerance,answer is C.Ensures fault tolerance,answer is censures fault tolerance,"['answer', 'censure', 'fault', 'tolerance']"
242,"Thanks, great Video 
I selected the option C - Ensure Fault tolerance","Thanks, great Video 
I selected the option C - Ensure Fault tolerance",thanks great video i selected the option c ensure fault tolerance,"['thank', 'great', 'video', 'select', 'option', 'c', 'ensure', 'fault', 'tolerance']"
243,C! Great video,C! Great video,c great video,"['c', 'great', 'video']"
244,Good one ... answer is C.,Good one ... answer is C.,good one answer is c,"['good', 'one', 'answer', 'c']"
245,The correct answer should be c) ensures fault tolerance,The correct answer should be c) ensures fault tolerance,the correct answer should be c ensures fault tolerance,"['correct', 'answer', 'c', 'ensure', 'fault', 'tolerance']"
246,Amazing.....answer is C,Amazing.....answer is C,amazinganswer is c,"['amazinganswer', 'c']"
247,Really very good info. Thanks.,Really very good info. Thanks.,really very good info thanks,"['really', 'good', 'info', 'thank']"
248,Thanks,Thanks,thanks,['thank']
249,The answer is C ensures fault tolerance!,The answer is C ensures fault tolerance!,the answer is c ensures fault tolerance,"['answer', 'c', 'ensure', 'fault', 'tolerance']"
250,Answer C! Please make the Amazon voucher out to Jon and Patrick. Thanks Simplilearn ðŸ˜,Answer C! Please make the Amazon voucher out to Jon and Patrick. Thanks Simplilearn  beaming_face_with_smiling_eyes ,answer c please make the amazon voucher out to jon and patrick thanks simplilearn beaming_face_with_smiling_eyes,"['answer', 'c', 'please', 'make', 'amazon', 'voucher', 'jon', 'patrick', 'thank', 'simplilearn', 'beaming_face_with_smiling_eye']"
251,Option (c) Ensures Fault tolerance.,Option (c) Ensures Fault tolerance.,option c ensures fault tolerance,"['option', 'c', 'ensure', 'fault', 'tolerance']"
252,C. Ensure fault tolerance,C. Ensure fault tolerance,c ensure fault tolerance,"['c', 'ensure', 'fault', 'tolerance']"
253,c) ensures fault tolerance,c) ensures fault tolerance,c ensures fault tolerance,"['c', 'ensure', 'fault', 'tolerance']"
254,C. Ensure fault tolerance,C. Ensure fault tolerance,c ensure fault tolerance,"['c', 'ensure', 'fault', 'tolerance']"
255,a good intro,a good intro,a good intro,"['good', 'intro']"
256,"Advantages of the 3x replication Schema in HdFS is b,c,d","Advantages of the 3x replication Schema in HdFS is b,c,d",advantages of the x replication schema in hdfs is bcd,"['advantage', 'x', 'replication', 'schema', 'hdfs', 'bcd']"
257,ensures fault tolerance since replication factor is 3 each 128 mb data will be replicated 3 times,ensures fault tolerance since replication factor is 3 each 128 mb data will be replicated 3 times,ensures fault tolerance since replication factor is each mb data will be replicated times,"['ensure', 'fault', 'tolerance', 'since', 'replication', 'factor', 'mb', 'datum', 'replicate', 'time']"
258,The 3x replication schema ensures fault tolerance,The 3x replication schema ensures fault tolerance,the x replication schema ensures fault tolerance,"['x', 'replication', 'schema', 'ensure', 'fault', 'tolerance']"
259,Option C fault tolerance,Option C fault tolerance,option c fault tolerance,"['option', 'c', 'fault', 'tolerance']"
260,Option C is the correct Answer,Option C is the correct Answer,option c is the correct answer,"['option', 'c', 'correct', 'answer']"
